{
  "$schema": "https://json-schema.org/draft/2020-12/schema",
  "$id": "https://example.local/schemas/encounter.schema.json",
  "title": "Encounter",
  "type": "object",
  "additionalProperties": false,
  "required": ["name", "seed", "round_limit", "creatures"],
  "properties": {
    "name": {"type": "string", "minLength": 1},
    "seed": {"type": "integer"},
    "round_limit": {"type": "integer", "minimum": 1},
    "rules_version": {"type": "string", "default": "5.2.1"},
    "engine_version": {"type": "string", "default": "0.3.0"},
    "creatures": {"type": "array", "minItems": 2, "items": {"$ref": "creature.schema.json"}}
  }
}
