{
  "name": "Spell Catalog Demo",
  "seed": 1337,
  "round_limit": 10,
  "rules_version": "5.2.1",
  "engine_version": "0.3.0",
  "creatures": [
    {
      "id": "fighter_1",
      "name": "Human Fighter",
      "team": "heroes",
      "ac": 16,
      "max_hp": 20,
      "current_hp": 20,
      "initiative_bonus": 2,
      "saving_throws": {"str": 4, "dex": 1, "con": 3, "int": 0, "wis": 1, "cha": 0},
      "actions": [{"id": "longsword", "name": "Longsword", "kind": "attack", "attack_bonus": 5, "damage": "1d8+3", "damage_type": "slashing", "is_melee": true, "range_feet": 5}],
      "conditions": []
    },
    {
      "id": "wizard_1",
      "name": "Elf Wizard",
      "team": "heroes",
      "ac": 12,
      "max_hp": 14,
      "current_hp": 14,
      "initiative_bonus": 3,
      "saving_throws": {"str": -1, "dex": 3, "con": 1, "int": 5, "wis": 2, "cha": 0},
      "actions": [{"id": "cast_fire_bolt", "name": "Cast Fire Bolt", "kind": "spell", "spell_ref": "spell.fire_bolt", "attack_bonus_override": 5}],
      "conditions": []
    },
    {
      "id": "goblin_1",
      "name": "Goblin Raider",
      "team": "goblins",
      "ac": 15,
      "max_hp": 7,
      "current_hp": 7,
      "initiative_bonus": 2,
      "saving_throws": {"str": -1, "dex": 2, "con": 0, "int": -1, "wis": 0, "cha": -1},
      "actions": [{"id": "scimitar", "name": "Scimitar", "kind": "attack", "attack_bonus": 4, "damage": "1d6+2", "damage_type": "slashing", "is_melee": true, "range_feet": 5}],
      "conditions": []
    },
    {
      "id": "shaman_1",
      "name": "Goblin Shaman",
      "team": "goblins",
      "ac": 13,
      "max_hp": 10,
      "current_hp": 10,
      "initiative_bonus": 1,
      "saving_throws": {"str": -1, "dex": 1, "con": 0, "int": 1, "wis": 2, "cha": 0},
      "actions": [{"id": "cast_acid_splash", "name": "Cast Acid Splash", "kind": "spell", "spell_ref": "spell.acid_splash", "save_dc_override": 12}],
      "conditions": []
    }
  ]
}
